company_name,client_name,email,mobile,source,remark,designation,address,category,state,city,pincode,website
BigWit Energy Pvt Ltd,,,,renewable energy power plant ( GOOGLE),,,"JRX2+7GJ, MIDC, Chinchwad, Pimpri-Chinchwad, Maharashtra 411019",Solar energy company,Maharashtra,Pimpri-Chinchwad,411019,http://www.bigwitenergy.com/
Energy Mix India,,,,renewable energy power plant ( GOOGLE),,,"301,Rajlaxmi Apartment , TMV Colony ,Near Bank of Maharashtra, ,Gultekadi, Pune, Maharashtra 411037",Solar energy company,Maharashtra,Pune,411037,https://energymixindia.business.site/
Solaire Direct India | Solar PV Plant Developer,,,,renewable energy power plant ( GOOGLE),,,"pentagon P3, Magarpatta, Hadapsar, Pune, Maharashtra 411013",Solar photovoltaic power plant,Maharashtra,Pune,411013,
PowerSun India Pvt. Ltd.,,,2066484848,renewable energy power plant ( GOOGLE),,,"Aurum Avenue, Level 5, Baner - Balewadi Rd, Baner, Pune, Maharashtra 411045",Corporate office,,,411045,http://www.powersun.in/
Aryan Green Energy India Pvt. Ltd,,,9545520019,renewable energy power plant ( GOOGLE),,,"F-37 Basaweshwara Industrial Complex, near Vishweshwar Chowk, MIDC, Bhosari, Pune, Maharashtra 411026",Power plant consultant,Maharashtra,Pimpri-Chinchwad,411026,
GeWiS Renewpower - Solar EPC Company,,,2067122400,renewable energy power plant ( GOOGLE),,,"705-707, Nyati Emporius, Baner, Pune, Maharashtra 411045",Solar energy company,Maharashtra,Pune,411045,http://www.gewisrenew.com/
Kaivlya renewable energy solution pvt ltd,,,,renewable energy power plant ( GOOGLE),,,"Sairaj Colony, Sector No. 31, Akurdi, Pune, Maharashtra 411017",Solar photovoltaic power plant,Maharashtra,Pimpri-Chinchwad,411017,
ZTRIC India Pvt. Ltd,,,18001209232,renewable energy power plant ( GOOGLE),,,"501, Crystal Homes, Baner Rd, Sahyadri Farms, Pune, Maharashtra 411045",Solar energy company,Maharashtra,Pune,411045,http://www.ztric.com/
ReNew Power Limited,,,,renewable energy power plant ( GOOGLE),,,"304, 3rd Floor, Town Square, Shopping Centre, New Airport Rd, Mhada Colony, Viman Nagar, Pune, Maharashtra 411014",Solar energy company,Maharashtra,Pune,411014,https://renewpower.in/
All About Renewables,,,2026613855,renewable energy power plant ( GOOGLE),,,"Plot No.44, Hindustan Estates, Kalyani Nagar, Pune, Maharashtra 411006",Environment renewable natural resources,Maharashtra,Pune,411006,http://allaboutrenewables.com/
Nespro Renewable Energy Solutions,,,8956842113,renewable energy power plant ( GOOGLE),,,"S.N. 28, Plot No. 36, Balkrishna Society, H-232 Dhanakawadi, near Akshay Chintamani Ganesh Mandir, Pune, Maharashtra 411043",Industrial consultant,Maharashtra,Pune,411043,http://www.nespro.in/
SUNSEED POWER SOLUTION,,,7066138289,renewable energy power plant ( GOOGLE),,,"Surya Tower, 4th, Near, Mhatre Bridge, opp. TRENDS, Erandwane, Pune, Maharashtra 411004",Solar energy equipment supplier,Maharashtra,Pune,411004,http://sunseedpower.com/
RelyOn Solar Pvt. Ltd,,,2022953812,renewable energy power plant ( GOOGLE),,,"RelyOn Solar Pvt Ltd Shivana,2nd floor, above Royal Enfield Showroom - Siddh Auto, Kothrud, Pune, Maharashtra 411038",Solar energy company,Maharashtra,Pune,411038,http://www.relyonsolar.com/
AVIRO Energy India Pvt Ltd,,,9096656846,renewable energy power plant ( GOOGLE),,,"Sai Saroj Apartment, Pipeline Rd, Pune, Maharashtra 412101",Solar energy company,Maharashtra,Pimpri-Chinchwad,412101,http://www.aviroservices.com/
CaptureSolar Energy Limited,,,2060500504,renewable energy power plant ( GOOGLE),,,"S.No 114 & 115 /11/15 Flat No 4 & 5 2nd Floor Shubham Heights Next Idbi Bank Mumbai, Pune Banglore Highway Pashan Exit, Warje, Pune, Maharashtra 411058",Solar energy company,Maharashtra,Pune,411058,http://www.capturesolar.com/
World Institute of Sustainable Energy,,,2026613855,renewable energy power plant ( GOOGLE),,,"Plot No.44, Hindustan Estates, Road Number 2, Kalyani Nagar, Pune, Maharashtra 411006",Research institute,Maharashtra,Pune,411006,http://www.wisein.org/
Enrich Energy Pvt Ltd,,,2026050080,renewable energy power plant ( GOOGLE),,,"Koregaon Park, 302, The Orion Building, 11/1C, Main Road, Opp Don Bosco Youth Centre, Main Rd, Ragvilas Society, Koregaon Park, Pune, Maharashtra 411001",Solar energy company,Maharashtra,Pune,411001,http://www.enrichenergy.com/
Malaviya Solar Energy Consultancy,,,2026166162,renewable energy power plant ( GOOGLE),,,"T-301, Ashoka Mall, Bund Garden Rd, Pune, Maharashtra 411001",Consultant,Maharashtra,Pune,411001,http://www.malaviya.in/
SaurUrja Energy Systems Private Limited,,,,renewable energy power plant ( GOOGLE),,,"Saileeen' Building 3rd Floor, Karve Road, Main Road, Bhalekar Chawl, Erandwane, Pune, Maharashtra 411004",Solar energy company,Maharashtra,Pune,411004,
Fairdeal Greentech India Pvt Ltd,,,8600999996,renewable energy power plant ( GOOGLE),,,"Sharawati Society, Plot No. 4-B, Sr. No. 126/1A/2PL, next to Akshay Food Mart, near Shreeram Society, Warje, Pune, Maharashtra 411058",Solar energy company,Maharashtra,Pune,411058,
Shams Power Systems Pvt Ltd,,,8033769207,renewable energy power plant ( GOOGLE),,,"Office No. 3, Shantikunj Society, behind Kedari Garden, Wanowrie, Pune, Maharashtra 411040",Solar energy contractor,Maharashtra,Pune,411040,
RAD RENEWABLES,,,9172587537,renewable energy power plant ( GOOGLE),,,"Bhosale Plaza, A5, Pune - Solapur Rd, near Old Mohintara Hospital, Hadapsar, Pune, Maharashtra 411028",Solar energy company,Maharashtra,Pune,411028,
DEITY FUEL ENERGY PVT LTD.,,,2024530022,renewable energy power plant ( GOOGLE),,,"plot no 47-48, MAHALUNGE CHAKAN Industrial Estate,, Pandurang Industrial Area, Pune",Solar energy company,Maharashtra,Mahalunge,48,http://www.deityfuel.com/
Powercon Ventures India Pvt. Ltd.,,,2066484866,renewable energy power plant ( GOOGLE),,,"Level 5, AURUM AVENUE, New Balewadi Link Road,, Baner Gaon, Baner, Pune, Maharashtra 411045",Electric utility company,Maharashtra,Pune,411045,http://www.powercon.in/
Sparkel Power And Automation Solutions (Sparkel India),,,9168012136,renewable energy power plant ( GOOGLE),,,"S.No.7/3 Plot No.16 Anusaya Park, Pune, Maharashtra 411014",Solar energy company,Maharashtra,Pune,411014,http://www.sparkelindia.com/
Solar Power Plant,,,,renewable energy power plant ( GOOGLE),,,"HR49+5G8, Pune University, Ganeshkhind, Pune, Maharashtra 411007",Solar photovoltaic power plant,Maharashtra,Pune,411007,
Sprng Energy,,,2067490001,renewable energy power plant ( GOOGLE),,,"5, JJC Colony, Ramtekadi, Hadapsar, Pune, Maharashtra 411013",Solar energy equipment supplier,Maharashtra,Pune,411013,https://sprngenergy.com/contact-us/
h2e Power System Inc.,,,2026057576,renewable energy power plant ( GOOGLE),,,"GVJ6+5M5, Sangamvadi, Pune, Maharashtra 411001",Green energy supplier,Maharashtra,Pune,411001,http://www.h2epower.net/
Mitray Energy Solutions,,,8530593399,renewable energy power plant ( GOOGLE),,,"Office No. 310, 3rd Floor, Sun Radiant, Sr.no. 36/1B, Opposite: BPCL Petrol Pump, Khadi Machine Chowk, 411048",Corporate office,,,411048,http://mitrayenergy.com/
Renom Energy Services LLP,,,8446341555,renewable energy power plant ( GOOGLE),,,"Anand Square – B Wing, 3rd floor. No-302 & 303, opp. Symbiosis International Deemed University, Viman Nagar, Pune, Maharashtra 411014",Electric utility company,Maharashtra,Pune,411014,http://renom.in/
SgurrEnergy,,,6262555222,renewable energy power plant ( GOOGLE),,,"506 Clover Metropole, Level – 4, NIBM Rd, next to Clover Highlands Undri Road, Kondhwa, Pune, Maharashtra 411048",Energy supplier,Maharashtra,Pune,411048,http://sgurrenergy.in/
Hem Green Energy Solutions,,,8046030033,renewable energy power plant ( GOOGLE),,,"Sr. No. 61/5 B, Kasat Colony, Lane No. 11, Sai Nagar, Pune, Maharashtra 411046",Corporate office,,,411046,
"Solar Energy Consultant and Trainer, Pune",,,9665020206,renewable energy power plant ( GOOGLE),,,"Flat No. 8, Plot No. 15, Mazda Deluxe Homes Tank Road, Shantinagar, Off:, Alandi Rd, Yerawada, Pune, Maharashtra 411006",Solar energy company,Maharashtra,Pune,411006,https://greensolarguru.com/
"DMSS Infra (India) Pvt. Ltd.,",,,2026151487,renewable energy power plant ( GOOGLE),,,"204, Venus Apartment, Plot No. 294, North Main Road, Koregaon Park, near German Bakery, Sangamvadi, Pune, Maharashtra 411001",Solar energy company,Maharashtra,Pune,411001,http://www.dmssinfra.com/
Hinduja Renewables Energy Private Limited,,,2267879999,renewable energy power plant ( GOOGLE),,,"1st Floor, Building No, Solitaire Corporate Park, Unit No. 611/612, 6, Andheri Ghatkopar Link Road-Extension, Chakala, Andheri, Maharashtra 400093",Environment renewable natural resources,Maharashtra,Mumbai,400093,http://www.hindujarenewables.com/
Agni Solar Systems Pvt. Ltd.,,,2066434111,renewable energy power plant ( GOOGLE),,,"702 Onyx, N Main Rd, Koregaon Park, Pune, Maharashtra 411001",Solar energy equipment supplier,Maharashtra,Pune,411001,https://agnisolar.com/
Paras Planet,,,8788038100,renewable energy power plant ( GOOGLE),,,"T.S 65, Market Road, Khadki, Pune, Maharashtra 411003",Solar energy company,Maharashtra,Pune,411003,https://www.parasplanet.com/
Tata Power Solar,,,2066012741,renewable energy power plant ( GOOGLE),,,"91, Kavadewadi, Koregaon Park, Pune, Maharashtra 411001",Solar energy company,Maharashtra,Pune,411001,http://www.tatapowersolar.com/
Helios IoT Systems Pvt. Ltd.,,,8956941769,renewable energy power plant ( GOOGLE),,,"100, NCL Innovation Park, Dr Homi Bhabha Rd, Pashan, Pune, Maharashtra 411008",Solar energy company,Maharashtra,Pune,411008,https://www.apolloenergyanalytics.com/
Kirloskar Solar Technologies Private Limited,,,8308800595,renewable energy power plant ( GOOGLE),,,"17A, Training Facility Centre, 1A, Laxmanrao Kirloskar Rd, Khadki, Pune, Maharashtra 411003",Solar energy company,Maharashtra,Pune,411003,http://www.kirloskarsolar.com/
Samartha Greentech,,,9822001692,renewable energy power plant ( GOOGLE),,,"Shop No. 5, Rohan Prarthana, Gandhi Bhavan Rd, Behind Cummins, Chaitanya Nagar, Kothrud, Pune, Maharashtra 411038",Solar energy equipment supplier,,,411038,http://webcache.googleusercontent.com/
solar is my passion,,,,renewable energy power plant ( GOOGLE),,,"Raghubar niwas , Lane, A10, Gurudwara Colony, Lohegaon, Pune, Maharashtra 411047",Solar energy company,Maharashtra,Pune,411047,http://www.solarismypassion.com/
Anama Energies Pvt Ltd,,,9372228283,renewable energy power plant ( GOOGLE),,,"104, Mega Malhar Society, Behind Adindoshi Bus Depot, Aundh, Aundh, Pune, Maharashtra 411007",Power plant equipment supplier,Maharashtra,Pune,411007,
Evergreen Power,,,5166987066,renewable energy power plant ( GOOGLE),,,"306,Town Center - II, Andheri-Kurla Road, Mumbai, Maharashtra 400059",Environment renewable natural resources,Maharashtra,Mumbai,400059,http://egreenpwr.com/
Tata Power Renewable Energy Limited,,,2267171231,renewable energy power plant ( GOOGLE),,,"BLOCK-1, Corporate Centre A Block, 34, Sant Tukaram Road, Carnac Bunder, Mumbai, Maharashtra 400009",Solar energy company,Maharashtra,Mumbai,400009,https://www.tatapowerrenewables.com/
Punjab Renewable Energy Systems Pvt. Ltd.,,,2227570498,renewable energy power plant ( GOOGLE),,,"V Times Square, Palm Beach Rd, Sector 15, CBD Belapur, Navi Mumbai, Maharashtra 400614",Electric utility company,Maharashtra,Navi Mumbai,400614,http://www.prespl.com/
"Era Hydro Biotech Energy Pvt. Ltd.: Rainwater Harvesting, Sewage Treatment Plant in Pune",,,2027295469,renewable energy power plant ( GOOGLE),,,"Row house 1, Berry's Avenue 2, Ram Indu Park Lane no.3, Sapling School lane, Baner, Pune, Maharashtra 411045",Sewage treatment plant,Maharashtra,Pune,411045,https://erahydrobiotech.com/
Mahagenco Solar Power Plant,,,,renewable energy power plant ( GOOGLE),,,"8J52+FF2, Pune, Maharashtra 413802",Power station in Maharashtra,,,413802,
QCT Energy,,,9970187048,renewable energy power plant ( GOOGLE),,,"A-58, Ajmera Main Rd, Gharkul Housing Society, MHADa, Morewadi, Pimpri Colony, Pune, Maharashtra 411018",Solar energy company,Maharashtra,Pimpri-Chinchwad,411018,
Kiran Enviro-Tech Energy Pvt.Ltd.,,,,renewable energy power plant ( GOOGLE),,,"Sr.No 201, ', DP Rd, near kumar piccaso, Hadapsar, Pune, Maharashtra 411028",Environment renewable natural resources,,,411028,
OSG Oriana India - Solar Panel Distributor in India | Longi Solar Distributor in India,,,9145228222,renewable energy power plant ( GOOGLE),,,"Office No. 1&2, Silver Screen Building, Baner Rd, near Balewadi High Street, Sahyadri Farms, Baner, Pune, Maharashtra 411045",Solar energy equipment supplier,Maharashtra,Pune,411045,https://www.orianaindia.com/
Oriano Clean Energy Private Limited,,,9619571288,renewable energy power plant ( GOOGLE),,,"EL-38, S Central Rd, Electronic Zone, MIDC Industrial Area, Mahape, Navi Mumbai, Maharashtra 400710",Solar energy company,Maharashtra,Navi Mumbai,400710,http://www.oriano.com/
ASCONIK INDIA PVT LTD,,,9527161514,renewable energy power plant ( GOOGLE),,,"Satyalok Commercial Complex, ASCONIK INDIA PVT LTD Office No 17, Hadapsar, Pune, Maharashtra 411028",Solar energy company,Maharashtra,Pune,411028,
Visol Renewable Energy Solutions,,,9833097007,renewable energy power plant ( GOOGLE),,,"Kailas Business Park, Vikhroli (W, HMPL Surya Nagar, Vikhroli West, Mumbai, Maharashtra 400079",Solar energy company,Maharashtra,Mumbai,400079,https://visolindia.com/
RENEWABLE ENERGY INDIA PVT.LTD.,,,2222841453,renewable energy power plant ( GOOGLE),,,"157, BACKBAY RECLAMATION, OFF .J. TATA ROAD, JEEVAN BIMA MARG, Mumbai, Maharashtra 400020",Solar energy company,Maharashtra,Mumbai,400020,
ARS Solar Tech,,,8888806269,renewable energy power plant ( GOOGLE),,,"Gat no - 392, Alandi Markal Road, dhanore phata Dhanore, tal, Khed taluka, Maharashtra 412105",Solar energy company,Maharashtra,Khed taluka,412105,
FAIRDEAL CORPORATES SALES AND SERVICES,,,2025234567,renewable energy power plant ( GOOGLE),,,"126/b, Internal Rd, Sharavati Housing Society, Warje, Pune, Maharashtra 411052",Manufacturer,Maharashtra,Pune,411052,
AVAADA,,,2261408000,renewable energy power plant ( GOOGLE),,,"406, Hubtown Solaris, NS Phadke Marg, Andheri East, Mumbai, Maharashtra 400069",Electric utility company,Maharashtra,Mumbai,400069,http://www.avaadaenergy.com/
Savemax Solar Systems Pvt Ltd,,,9730015801,renewable energy power plant ( GOOGLE),,,"opp. lane of Pooja electronics, Manaji Nagar, Narhe, Pune, Maharashtra 411041",Manufacturer,Maharashtra,Pune,411041,http://www.savemaxsolar.com/
Alligator Solar,,,9028641818,renewable energy power plant ( GOOGLE),,,"Plot No.7, Gat No. 627/1/1B, Kurali, Tal Khed Chakan, Pimpri Chinchwad, Pune, Maharashtra 410501",Solar energy company,Maharashtra,Kurali,410501,http://www.alligatorsolar.com/
GP Green Energy Systems Pvt. Ltd.,,,2025511999,renewable energy power plant ( GOOGLE),,,"1163, Cresent Exclusee, Flat No. 9, Shivajinagar, next to Shimla Office, Pune, Maharashtra 411005",Technology park,Maharashtra,Pune,411005,
Dynamic Corporate Solutions Pvt. Ltd.,,,2065220523,renewable energy power plant ( GOOGLE),,,"Building, 14-A First floor, Town Square, New Airport Rd, Viman Nagar, Pune, Maharashtra 411014",Corporate office,,,411014,http://dynamicsolarprojects.com/
Insolergy Technologies - Solar Energy EPC Company,,,9082786504,renewable energy power plant ( GOOGLE),,,,,,,,
SolarQuarter,,,,renewable energy power plant ( GOOGLE),,,"Plot No. 74, Sector 15, CBD Belapur, Navi Mumbai, Maharashtra 400614",Solar energy company,Maharashtra,Navi Mumbai,400614,http://solarquarter.com/
Green Solar Park,,,2226417791,renewable energy power plant ( GOOGLE),,,"88R7+M7V, Pen, Maharashtra 402107",Solar energy company in Maharashtra,,,402107,
SURYAURJAA TECHNOLOGY (Solar Project Specialist),,,7775810924,renewable energy power plant ( GOOGLE),,,"HFV2+CC9, Vaduj, Maharashtra 411046",Solar energy company,Maharashtra,Vaduj,411046,http://www.suryaurjaatechnology.com/
Continuum Green Energy (India) Pvt Ltd,,,2225701567,renewable energy power plant ( GOOGLE),,,"Delphi Building, C 402/404, Orchard Ave, Hiranandani Gardens, Panchkutir Ganesh Nagar, Powai, Mumbai, Maharashtra 400076",Electric utility company,Maharashtra,Mumbai,400076,
Artha Energy Resources,,,2261048900,renewable energy power plant ( GOOGLE),,,"Surya Mahal, No.5, 1st, Building, B Bharucha Rd, Kala Ghoda, Fort, Mumbai, Maharashtra 400001",Solar energy company,Maharashtra,Mumbai,400001,http://artha.energy/
CleanMax,,,2262520000,renewable energy power plant ( GOOGLE),,,"RB Business Center, Survey no 187 Plot Number 2, Sanghvi Nagar, Aundh, Pune, Maharashtra 411007",Solar energy company,Maharashtra,Pune,411007,https://www.cleanmax.com/
AFM SOLAR SYSTEM PVT.LTD.,,,9881875164,renewable energy power plant ( GOOGLE),,,"Meera Society, 3rd Floor,The Hub, Lane No. 6, above Subway, Meera Nagar, Pune, Maharashtra 411001",Solar energy company,Maharashtra,Pune,411001,
REECODE Energy Solutions,,,9324246639,renewable energy power plant ( GOOGLE),,,"1, A3, Satya Darshan Society, Radha Krishna Nagar, Malpa Dongri, Andheri East, Mumbai, Maharashtra 400093",Solar energy company,Maharashtra,Mumbai,400093,https://reecode.business.site/
FEVINO INDUSTRIES,,,8698151597,renewable energy power plant ( GOOGLE),,,"Sr. No.36, 1/1, Sinhgad Rd, near Lokmat Press, Vadgaon Khurd, Pandurang Industrial Area, Pune, Maharashtra 411041",Solar energy company,Maharashtra,Pune,411041,https://www.fevino.in/
SolarEra Green Renewables Private Limited,,,,renewable energy power plant ( GOOGLE),,,"Office no 204 , Sanskriti Arcade, opp. PCMC School, Wakad, Pune, Maharashtra 411057",Solar energy company,Maharashtra,Pimpri-Chinchwad,411057,http://www.solar-era.co.in/
Solar Bizlee Office,,,9867434739,renewable energy power plant ( GOOGLE),,,"31 Plot No 48, Neco Chamber, Sector 11, CBD Belapur, Navi Mumbai, Maharashtra 400614",Solar energy company,Maharashtra,Navi Mumbai,400614,
Kurnool Ultra Mega Solar Park,,,,renewable energy power plant ( GOOGLE),,,"M7JM+C2C, Kurnool, Andhra Pradesh 518010",Solar photovoltaic power plant in Andhra Pradesh,,,518010,
India One Solar Thermal Power Plant,,,7290062516,renewable energy power plant ( GOOGLE),,,"GQ8P+M8W, Shantivan, Abu Road, Rajasthan 307510",Solar energy company,Rajasthan,Abu Road,307510,http://www.india-one.net/
Enerparc Energy Private Limited - Solar Developers in India,,,,renewable energy power plant ( GOOGLE),,,"814/815 C, Park Site Rd, B Wing, HMPL Surya Nagar, Vikhroli West, Mumbai, Maharashtra 400079",Solar energy contractor,Maharashtra,Mumbai,400079,http://www.enerparc.in/
Alfa Infraprop Pvt. Ltd.,,,2242429999,renewable energy power plant ( GOOGLE),,,"6th Floor, Civic Centre, Dasturwadi, Naigaon Cross Road, Dadar (East), Mumbai, Maharashtra 400014",Solar energy company,Maharashtra,Mumbai,400014,http://alfainfraprop.com/
SIKCO Engineering Services Pvt. Ltd,,,,renewable energy power plant ( GOOGLE),,,"SIKCO House, B-97, Sector 12, Kharghar, Navi Mumbai, Maharashtra 410210",Solar energy company,Maharashtra,Navi Mumbai,410210,https://sikco-engineering-services-pvt-ltd.business.site/?utm_source=gmb&utm_medium=referral
Fairdeal Greentech India Private Limited,,,,renewable energy power plant ( GOOGLE),,,"2B, Street Number 37, Omkar Colony, Sasane Nagar, Hadapsar, Pune, Maharashtra 411028",Corporate office,,,411028,
PRASHANT SOLAR,,,7977747687,renewable energy power plant ( GOOGLE),,,"W-76, Anand Nagar, Additional M.I.D.C, Ambernath, Maharashtra 421506",Solar energy company,Maharashtra,Ambarnath,421506,http://www.prashantsolar.com/
Solpower Green Pvt. Ltd.,,,,renewable energy power plant ( GOOGLE),,,"3, Varma Nagar Rd, Verma Nagar, Jijamata Colony, Andheri East, Mumbai, Maharashtra 400069",Corporate office,,,400069,http://www.solpowergreen.com/
AWT Energy Pvt Ltd,,,2240012697,renewable energy power plant ( GOOGLE),,,"9th Floor, 'C' Wing, Godrej Coliseum, Sion - Trombay Rd, Sion, Mumbai, Maharashtra 400022",Wind farm,Maharashtra,Mumbai,400022,http://awtenergy.com/
Endurance Energy Services,,,8976706017,renewable energy power plant ( GOOGLE),,,"A-301, Indraangan, Plot-2, Sector 9, Khanda Colony, Navi Mumbai, Maharashtra 410206",Solar energy company,Maharashtra,Navi Mumbai,410206,
Prime Renewable energy,,,,renewable energy power plant ( GOOGLE),,,"22, Near queen mary high school, Pimpripada, Malad East, Mumbai, Maharashtra 400097",Solar energy company,Maharashtra,Mumbai,400097,https://m.indiamart.com/prime-renewable-energy/
Vidhyut Power and Systems,,,2225422238,renewable energy power plant ( GOOGLE),,,"BG-002, Raj Darshan Society, Dada Patil Wadi, Near Platform No. 1, Thane West, Thane, Maharashtra 400602",Electric utility company,Maharashtra,Thane,400602,http://www.vidhyutenergy.com/
"Solar Power Plant by Rites Systems, Pune",,,,renewable energy power plant ( GOOGLE),,,"NH 166E, Lugadewadi, Maharashtra 415205",Solar photovoltaic power plant,Maharashtra,Lugadewadi,415205,
Waaree Renewable Technologies Limited,,,2266444444,renewable energy power plant ( GOOGLE),,,"Western Edge I, 504, Western Express Hwy, Food Corporation of India Warehouse, Borivali East, Mumbai, Maharashtra 400066",Solar energy company,Maharashtra,Mumbai,400066,http://www.waareertl.com/
Samson Solar Technology,,,2512621681,renewable energy power plant ( GOOGLE),,,"Plot No. N-49/1, M.I.D.C. Add. Ambernath Indl. Area Ambernath (E), Thane, Maharashtra 421506",Corporate office,,,421506,http://samsonsolar.in/
Solergy Renewables LLP,,,9920363170,renewable energy power plant ( GOOGLE),,,"D-201, Ruparel Gardens, Plot-C3, Sector-23 Nerul East, Opp. Haware Centurian Mall, Navi Mumbai, Maharashtra 400706",Solar energy company,Maharashtra,Navi Mumbai,400706,http://www.solergy.co.in/
Gogreen Ventures,,,8097666000,renewable energy power plant ( GOOGLE),,,"Shop No. 3, Sangita Apartment, Opposite Ganesh Cinema, Charai, Thane, Maharashtra 400601",Solar energy company,Maharashtra,Thane,400601,http://www.gogreenventures.in/
NSA SOLAR PRIVATE LIMITED,,,8308756789,renewable energy power plant ( GOOGLE),,,"G-Square Business Park, Office No 2001, 20th, Sector 30A, Vashi, Navi Mumbai, Maharashtra 400703",Solar energy equipment supplier,Maharashtra,Navi Mumbai,400703,
Pavagada Solar Park,,,,renewable energy power plant ( GOOGLE),,,"48Q7+7VC, Palavalli, Karnataka 572202",Solar photovoltaic power plant,Karnataka,Palavalli,572202,
MSL 14MW Solar Power Plant,,,,renewable energy power plant ( GOOGLE),,,"VHVJ+8PF, Naigaon, Maharashtra 414204",Solar photovoltaic power plant,Maharashtra,Naigaon,414204,
Abhay BIO CNG PVT LTD,,,8446951010,renewable energy power plant ( GOOGLE),,,"Nilgiri Height, B1, Sr.No. 103, Bahiratwadi Senapati Bapat Road Pune Maharashtra 411016 IN, Shivaji Co operative Housing Society, Bhageerath, Gokhalenagar, Pune, Maharashtra 411016",Waste management service,Maharashtra,Pune,411016,http://abhaybiocng.com/
Kinetic Green Energy & Power Solution ltd,,,2066142041,renewable energy power plant ( GOOGLE),,,"D-1 Block,Plot, Innovation Park, 18/2, 411019, MIDC, Bhosari, Pimpri-Chinchwad, Maharashtra 411019",Corporate office,,,411019,https://kineticgreenvehicles.com/
PV Power Technologies Pvt. Ltd.,,,2242214800,renewable energy power plant ( GOOGLE),,,"B 907 Kanakia Wall Street Chakala, Andheri - Kurla Rd, Andheri East, Mumbai, Maharashtra 400093",Solar energy equipment supplier,Maharashtra,Mumbai,400093,http://www.pvpowertech.com/
Vision Media Group,,,9743278317,renewable energy power plant ( GOOGLE),,,"No 9, IInd Floor, A - Wing, Ananddeep Bldg. No 3, Pendse Nagar, Dombivili East, near Andhra Bank, Thane, Maharashtra 421201",Media company,Maharashtra,Dombivli,421201,http://www.vision-media.co.in/
Bhadla Solar Park,,,9457052923,renewable energy power plant ( GOOGLE),,,"GW9J+25J, Bhadlachuhron Ki, Rajasthan 342301",Solar photovoltaic power plant,Rajasthan,Bhadlachuhron Ki,342301,
"TT4, Solar Arise Power Plant",,,,renewable energy power plant ( GOOGLE),,,"X673+HFX, Beed, Maharashtra 431128",Solar photovoltaic power plant in Maharashtra,,,431128,
Kadapa Ultra Mega Solar Park,,,,renewable energy power plant ( GOOGLE),,,"W78R+HQ4, Ponnampalle, Andhra Pradesh 516433",Solar photovoltaic power plant,Andhra Pradesh,Ponnampalle,516433,
Axis energy ventures india pvt.ltd,,,4023412312,renewable energy power plant ( GOOGLE),,,"House No- 6-3-680/8/3 Plot No-3 PMR Plaza India, Thakur Mansion Ln, Durga Nagar Colony, Somajiguda, Hyderabad, Telangana 500082",Electric utility company,Telangana,Hyderabad,500082,http://axisenergy.in/
Solenco,,,,renewable energy power plant ( GOOGLE),,,"A-219, Kanakia Zillion, BKC Annexe, Lal Bahadur Shastri Rd, Kurla West, Mumbai, Maharashtra 400070",Solar energy company,Maharashtra,Mumbai,400070,http://solencoinfra.com/
Four Solar Energy Systems Pvt Ltd,,,4023405670,renewable energy power plant ( GOOGLE),,,"6-3-1109/1/P/402 4th Floor, Jewel Pawani Tower, Raj Bhavan Rd, Somajiguda, Hyderabad, Telangana 500082",Solar energy company,Telangana,Hyderabad,500082,https://www.foursolar.com/
Fuji Electric Consul Neowatt Pvt. Ltd.,,,2064784041,renewable energy power plant ( GOOGLE),,,"Sr. No. 36/1/1, 36/3, 1, Holkarwadi, Maharashtra 412308",Manufacturer,Maharashtra,Pune,412308,https://www.india.fujielectric.com/
5MW Solar Power Plant Varroc,,,7774004790,renewable energy power plant ( GOOGLE),,,"395F+W6V, Vehergaon, Maharashtra 424305",Solar photovoltaic power plant,Maharashtra,Vehergaon,424305,http://varroc.com/
Gujarat Solar Park,,,,renewable energy power plant ( GOOGLE),,,"W52V+RWJ, Santanpur, Charanka, Gujarat 385350",Solar photovoltaic power plant in Gujarat,,,385350,
,,,,renewable energy power plant ( GOOGLE),,,,,,,,
,,,,renewable energy power plant ( GOOGLE),,,,,,,,
,,,,renewable energy power plant ( GOOGLE),,,,,,,,
,,,,renewable energy power plant ( GOOGLE),,,,,,,,
,,,,renewable energy power plant ( GOOGLE),,,,,,,,
,,,,renewable energy power plant ( GOOGLE),,,,,,,,
,,,,renewable energy power plant ( GOOGLE),,,,,,,,
,,,,renewable energy power plant ( GOOGLE),,,,,,,,
,,,,renewable energy power plant ( GOOGLE),,,,,,,,
,,,,renewable energy power plant ( GOOGLE),,,,,,,,
,,,,renewable energy power plant ( GOOGLE),,,,,,,,
