company_name,client_name,email,mobile,source,remark,designation,address,category,state,city,pincode,website
Neon Link Innovations Private ,"
Nitin Nandraj Shinde",nitin.shinde@neonlink.in,9820599056,india mart catelogue calling,,,"Mumbai, Maharashtra",Img 120t Industrial Modbus Gateway,,,,
Taurus Automations And Controls,KESAVAN R,ksvn1@yahoo.com,8939887905,india mart catelogue calling,,,"Chennai, Tamil Nadu",Industrial Compact Liu Din Rail Mounted,,,,
,Ranjith Kumar J,hjranjith85@gmail.com,9738478066,india mart catelogue calling,,,"Bengaluru, Karnataka",277 Fiber Converter,,,,
P Square Group,SUDEEP PAWAR,p2square4@gmail.com,7710010297,india mart catelogue calling,,,"Nashik, Maharashtra",Ray-1 Data Logger,,,,
